{
  "analyses": [
    {
      "analysisId": "e-134abb950c119a04f457c262",
      "constraints": [
        {
          "actual": 817,
          "comparison": "<=",
          "constraintId": "e-edece2eeb131f3ced8692da0",
          "expression": "totalMassResult<=c0Configuration.maximumMass",
          "expressionAst": {
            "kind": "binary",
            "left": {
              "kind": "reference",
              "path": "totalMassResult"
            },
            "operator": "<=",
            "right": {
              "kind": "reference",
              "path": "c0Configuration.maximumMass"
            }
          },
          "margin": -17.000000000000014,
          "name": "massWithinLimit",
          "resultParameterId": "e-57bed2927ecea8cab26f9982",
          "source": {
            "end": {
              "column": 35,
              "line": 74,
              "offset": 3229
            },
            "start": {
              "column": 20,
              "line": 74,
              "offset": 3214
            },
            "uri": "file:///D:/Document/4.AIStudy/13.AIProject/7.RoB/AIDC/samples/jingang-10axis-system-design/analysis/calculation-contract.sysml"
          },
          "status": "fail",
          "target": 800,
          "unit": "g"
        },
        {
          "actual": 1.9199999999999997,
          "comparison": ">=",
          "constraintId": "e-972ac02b4b69f7abb85032f0",
          "expression": "enduranceResult>=c0Configuration.minimumEndurance",
          "expressionAst": {
            "kind": "binary",
            "left": {
              "kind": "reference",
              "path": "enduranceResult"
            },
            "operator": ">=",
            "right": {
              "kind": "reference",
              "path": "c0Configuration.minimumEndurance"
            }
          },
          "margin": -0.08000000000000025,
          "name": "enduranceMeetsMinimum",
          "resultParameterId": "e-963c40b7cc542b7e4b86c055",
          "source": {
            "end": {
              "column": 41,
              "line": 83,
              "offset": 3745
            },
            "start": {
              "column": 20,
              "line": 83,
              "offset": 3724
            },
            "uri": "file:///D:/Document/4.AIStudy/13.AIProject/7.RoB/AIDC/samples/jingang-10axis-system-design/analysis/calculation-contract.sysml"
          },
          "status": "fail",
          "target": 2,
          "unit": "h"
        },
        {
          "actual": 19.840000000000003,
          "comparison": "<=",
          "constraintId": "e-e7e23c906fcdf3f3cee92e61",
          "expression": "peakElectricalPowerResult<=maximumPeakElectricalPower",
          "expressionAst": {
            "kind": "binary",
            "left": {
              "kind": "reference",
              "path": "peakElectricalPowerResult"
            },
            "operator": "<=",
            "right": {
              "kind": "reference",
              "path": "maximumPeakElectricalPower"
            }
          },
          "margin": -0.6400000000000006,
          "name": "peakElectricalPowerWithinLimit",
          "resultParameterId": "e-a95b414d92c82bc70f8f26a9",
          "source": {
            "end": {
              "column": 50,
              "line": 93,
              "offset": 4358
            },
            "start": {
              "column": 20,
              "line": 93,
              "offset": 4328
            },
            "uri": "file:///D:/Document/4.AIStudy/13.AIProject/7.RoB/AIDC/samples/jingang-10axis-system-design/analysis/calculation-contract.sysml"
          },
          "status": "fail",
          "target": 19.200000000000003,
          "unit": "W"
        },
        {
          "actual": 128,
          "comparison": "<=",
          "constraintId": "e-cf00e23e40cf2d6aaa30f90c",
          "expression": "stopResponseTimeResult<=c0Configuration.maximumStopTime",
          "expressionAst": {
            "kind": "binary",
            "left": {
              "kind": "reference",
              "path": "stopResponseTimeResult"
            },
            "operator": "<=",
            "right": {
              "kind": "reference",
              "path": "c0Configuration.maximumStopTime"
            }
          },
          "margin": 372,
          "name": "stopResponseWithinLimit",
          "resultParameterId": "e-0d9296bd253d1cf81eac7e77",
          "source": {
            "end": {
              "column": 43,
              "line": 103,
              "offset": 4849
            },
            "start": {
              "column": 20,
              "line": 103,
              "offset": 4826
            },
            "uri": "file:///D:/Document/4.AIStudy/13.AIProject/7.RoB/AIDC/samples/jingang-10axis-system-design/analysis/calculation-contract.sysml"
          },
          "status": "pass",
          "target": 500,
          "unit": "ms"
        }
      ],
      "dependencies": [
        {
          "sourceParameterId": "e-0d9296bd253d1cf81eac7e77",
          "targetParameterId": "e-78217345c83e40c74a5c42f6"
        },
        {
          "sourceParameterId": "e-0d9296bd253d1cf81eac7e77",
          "targetParameterId": "e-7834d131c6133caee51cf27e"
        },
        {
          "sourceParameterId": "e-0d9296bd253d1cf81eac7e77",
          "targetParameterId": "e-f74abbcbdbe5074312f31def"
        },
        {
          "sourceParameterId": "e-1864190909e3a790c782fd55",
          "targetParameterId": "e-57bed2927ecea8cab26f9982"
        },
        {
          "sourceParameterId": "e-1864190909e3a790c782fd55",
          "targetParameterId": "e-91bf321afa4a631aada9c9a3"
        },
        {
          "sourceParameterId": "e-4df671837d825798f1525d75",
          "targetParameterId": "e-632d9f9edf3275ad091fa6fd"
        },
        {
          "sourceParameterId": "e-4df671837d825798f1525d75",
          "targetParameterId": "e-963c40b7cc542b7e4b86c055"
        },
        {
          "sourceParameterId": "e-57bed2927ecea8cab26f9982",
          "targetParameterId": "e-4d6cfc309a8a0001dc37709f"
        },
        {
          "sourceParameterId": "e-57bed2927ecea8cab26f9982",
          "targetParameterId": "e-5c76e5b50816d0460c0fd457"
        },
        {
          "sourceParameterId": "e-57bed2927ecea8cab26f9982",
          "targetParameterId": "e-d913b8d049211fb61e9b8c49"
        },
        {
          "sourceParameterId": "e-8eb7402fffd3387de5492731",
          "targetParameterId": "e-0d9296bd253d1cf81eac7e77"
        },
        {
          "sourceParameterId": "e-8eb7402fffd3387de5492731",
          "targetParameterId": "e-c1720fdbf33366901e63a9be"
        },
        {
          "sourceParameterId": "e-963c40b7cc542b7e4b86c055",
          "targetParameterId": "e-18ffa57fbbc4783708cc30c3"
        },
        {
          "sourceParameterId": "e-963c40b7cc542b7e4b86c055",
          "targetParameterId": "e-24d74a2c0e3c83a8bc63ea75"
        },
        {
          "sourceParameterId": "e-963c40b7cc542b7e4b86c055",
          "targetParameterId": "e-6019b63195a36df0f853b6d8"
        },
        {
          "sourceParameterId": "e-963c40b7cc542b7e4b86c055",
          "targetParameterId": "e-64bed58bd427ce9c8bf05545"
        },
        {
          "sourceParameterId": "e-963c40b7cc542b7e4b86c055",
          "targetParameterId": "e-cb39457c858ddbe1abed7821"
        },
        {
          "sourceParameterId": "e-a95b414d92c82bc70f8f26a9",
          "targetParameterId": "e-64bed58bd427ce9c8bf05545"
        },
        {
          "sourceParameterId": "e-a95b414d92c82bc70f8f26a9",
          "targetParameterId": "e-c2cd1deeece4fb967d432c3a"
        },
        {
          "sourceParameterId": "e-a95b414d92c82bc70f8f26a9",
          "targetParameterId": "e-d49354702dd3f8dca571a5bf"
        },
        {
          "sourceParameterId": "e-bf5d287897c2aa3eb78f39a1",
          "targetParameterId": "e-64bed58bd427ce9c8bf05545"
        },
        {
          "sourceParameterId": "e-bf5d287897c2aa3eb78f39a1",
          "targetParameterId": "e-fb5da6f932b25962b6d0fb55"
        },
        {
          "sourceParameterId": "e-cba582cd477dd9817d34ea10",
          "targetParameterId": "e-a95b414d92c82bc70f8f26a9"
        },
        {
          "sourceParameterId": "e-cba582cd477dd9817d34ea10",
          "targetParameterId": "e-bf5d287897c2aa3eb78f39a1"
        }
      ],
      "evaluationOrder": [
        "e-57bed2927ecea8cab26f9982",
        "e-1864190909e3a790c782fd55",
        "e-963c40b7cc542b7e4b86c055",
        "e-4df671837d825798f1525d75",
        "e-a95b414d92c82bc70f8f26a9",
        "e-bf5d287897c2aa3eb78f39a1",
        "e-cba582cd477dd9817d34ea10",
        "e-0d9296bd253d1cf81eac7e77",
        "e-8eb7402fffd3387de5492731"
      ],
      "name": "coreParameterAnalysis",
      "results": [
        {
          "calculationDefinitionId": "e-69d529e6aeffca85718e0faa",
          "calculationUsageId": "cu-ef642fbd15596de294c15156",
          "dimension": "M^1",
          "formula": "ComputeTotalMass(c0Configuration.servoCount,c0Configuration.servoUnitMass,c0Configuration.otherPlannedMass)",
          "formulaAst": {
            "arguments": [
              {
                "kind": "reference",
                "path": "c0Configuration.servoCount"
              },
              {
                "kind": "reference",
                "path": "c0Configuration.servoUnitMass"
              },
              {
                "kind": "reference",
                "path": "c0Configuration.otherPlannedMass"
              }
            ],
            "callee": "ComputeTotalMass",
            "kind": "call"
          },
          "inputParameterIds": [
            "e-4d6cfc309a8a0001dc37709f",
            "e-57bed2927ecea8cab26f9982",
            "e-5c76e5b50816d0460c0fd457",
            "e-889b97934241336e10ac1dc7",
            "e-d913b8d049211fb61e9b8c49"
          ],
          "name": "totalMassResult",
          "parameterId": "e-57bed2927ecea8cab26f9982",